<?xml version="1.0" encoding="UTF-8"?>
<dataroot xmlns:od="urn:schemas-microsoft-com:officedata" xmlns:xsi="http://www.w3.org/2001/XMLSchema-instance"  xsi:noNamespaceSchemaLocation="41_ScaleItemConceptMap.xsd" generated="2025-07-15T15:44:24">
<_x0034_1_ScaleItemConceptMap>
<ScaleItemConceptID>1</ScaleItemConceptID>
<ScaleID>1</ScaleID>
<ItemConceptID>45</ItemConceptID>
</_x0034_1_ScaleItemConceptMap>
<_x0034_1_ScaleItemConceptMap>
<ScaleItemConceptID>2</ScaleItemConceptID>
<ScaleID>1</ScaleID>
<ItemConceptID>26</ItemConceptID>
</_x0034_1_ScaleItemConceptMap>
<_x0034_1_ScaleItemConceptMap>
<ScaleItemConceptID>3</ScaleItemConceptID>
<ScaleID>1</ScaleID>
<ItemConceptID>14</ItemConceptID>
</_x0034_1_ScaleItemConceptMap>
<_x0034_1_ScaleItemConceptMap>
<ScaleItemConceptID>4</ScaleItemConceptID>
<ScaleID>1</ScaleID>
<ItemConceptID>46</ItemConceptID>
</_x0034_1_ScaleItemConceptMap>
<_x0034_1_ScaleItemConceptMap>
<ScaleItemConceptID>5</ScaleItemConceptID>
<ScaleID>1</ScaleID>
<ItemConceptID>41</ItemConceptID>
</_x0034_1_ScaleItemConceptMap>
<_x0034_1_ScaleItemConceptMap>
<ScaleItemConceptID>6</ScaleItemConceptID>
<ScaleID>1</ScaleID>
<ItemConceptID>36</ItemConceptID>
</_x0034_1_ScaleItemConceptMap>
<_x0034_1_ScaleItemConceptMap>
<ScaleItemConceptID>7</ScaleItemConceptID>
<ScaleID>1</ScaleID>
<ItemConceptID>44</ItemConceptID>
</_x0034_1_ScaleItemConceptMap>
<_x0034_1_ScaleItemConceptMap>
<ScaleItemConceptID>8</ScaleItemConceptID>
<ScaleID>1</ScaleID>
<ItemConceptID>3</ItemConceptID>
</_x0034_1_ScaleItemConceptMap>
<_x0034_1_ScaleItemConceptMap>
<ScaleItemConceptID>9</ScaleItemConceptID>
<ScaleID>1</ScaleID>
<ItemConceptID>2</ItemConceptID>
</_x0034_1_ScaleItemConceptMap>
<_x0034_1_ScaleItemConceptMap>
<ScaleItemConceptID>10</ScaleItemConceptID>
<ScaleID>2</ScaleID>
<ItemConceptID>35</ItemConceptID>
</_x0034_1_ScaleItemConceptMap>
<_x0034_1_ScaleItemConceptMap>
<ScaleItemConceptID>11</ScaleItemConceptID>
<ScaleID>2</ScaleID>
<ItemConceptID>29</ItemConceptID>
</_x0034_1_ScaleItemConceptMap>
<_x0034_1_ScaleItemConceptMap>
<ScaleItemConceptID>12</ScaleItemConceptID>
<ScaleID>2</ScaleID>
<ItemConceptID>34</ItemConceptID>
</_x0034_1_ScaleItemConceptMap>
<_x0034_1_ScaleItemConceptMap>
<ScaleItemConceptID>13</ScaleItemConceptID>
<ScaleID>2</ScaleID>
<ItemConceptID>30</ItemConceptID>
</_x0034_1_ScaleItemConceptMap>
<_x0034_1_ScaleItemConceptMap>
<ScaleItemConceptID>14</ScaleItemConceptID>
<ScaleID>2</ScaleID>
<ItemConceptID>33</ItemConceptID>
</_x0034_1_ScaleItemConceptMap>
<_x0034_1_ScaleItemConceptMap>
<ScaleItemConceptID>15</ScaleItemConceptID>
<ScaleID>2</ScaleID>
<ItemConceptID>28</ItemConceptID>
</_x0034_1_ScaleItemConceptMap>
<_x0034_1_ScaleItemConceptMap>
<ScaleItemConceptID>16</ScaleItemConceptID>
<ScaleID>2</ScaleID>
<ItemConceptID>27</ItemConceptID>
</_x0034_1_ScaleItemConceptMap>
<_x0034_1_ScaleItemConceptMap>
<ScaleItemConceptID>17</ScaleItemConceptID>
<ScaleID>2</ScaleID>
<ItemConceptID>22</ItemConceptID>
</_x0034_1_ScaleItemConceptMap>
<_x0034_1_ScaleItemConceptMap>
<ScaleItemConceptID>18</ScaleItemConceptID>
<ScaleID>2</ScaleID>
<ItemConceptID>47</ItemConceptID>
</_x0034_1_ScaleItemConceptMap>
<_x0034_1_ScaleItemConceptMap>
<ScaleItemConceptID>19</ScaleItemConceptID>
<ScaleID>4</ScaleID>
<ItemConceptID>12</ItemConceptID>
</_x0034_1_ScaleItemConceptMap>
<_x0034_1_ScaleItemConceptMap>
<ScaleItemConceptID>20</ScaleItemConceptID>
<ScaleID>4</ScaleID>
<ItemConceptID>10</ItemConceptID>
</_x0034_1_ScaleItemConceptMap>
<_x0034_1_ScaleItemConceptMap>
<ScaleItemConceptID>21</ScaleItemConceptID>
<ScaleID>4</ScaleID>
<ItemConceptID>21</ItemConceptID>
</_x0034_1_ScaleItemConceptMap>
<_x0034_1_ScaleItemConceptMap>
<ScaleItemConceptID>22</ScaleItemConceptID>
<ScaleID>4</ScaleID>
<ItemConceptID>17</ItemConceptID>
</_x0034_1_ScaleItemConceptMap>
<_x0034_1_ScaleItemConceptMap>
<ScaleItemConceptID>23</ScaleItemConceptID>
<ScaleID>4</ScaleID>
<ItemConceptID>16</ItemConceptID>
</_x0034_1_ScaleItemConceptMap>
<_x0034_1_ScaleItemConceptMap>
<ScaleItemConceptID>24</ScaleItemConceptID>
<ScaleID>4</ScaleID>
<ItemConceptID>13</ItemConceptID>
</_x0034_1_ScaleItemConceptMap>
<_x0034_1_ScaleItemConceptMap>
<ScaleItemConceptID>25</ScaleItemConceptID>
<ScaleID>4</ScaleID>
<ItemConceptID>5</ItemConceptID>
</_x0034_1_ScaleItemConceptMap>
<_x0034_1_ScaleItemConceptMap>
<ScaleItemConceptID>26</ScaleItemConceptID>
<ScaleID>4</ScaleID>
<ItemConceptID>15</ItemConceptID>
</_x0034_1_ScaleItemConceptMap>
<_x0034_1_ScaleItemConceptMap>
<ScaleItemConceptID>27</ScaleItemConceptID>
<ScaleID>4</ScaleID>
<ItemConceptID>9</ItemConceptID>
</_x0034_1_ScaleItemConceptMap>
<_x0034_1_ScaleItemConceptMap>
<ScaleItemConceptID>28</ScaleItemConceptID>
<ScaleID>4</ScaleID>
<ItemConceptID>11</ItemConceptID>
</_x0034_1_ScaleItemConceptMap>
<_x0034_1_ScaleItemConceptMap>
<ScaleItemConceptID>29</ScaleItemConceptID>
<ScaleID>5</ScaleID>
<ItemConceptID>7</ItemConceptID>
</_x0034_1_ScaleItemConceptMap>
<_x0034_1_ScaleItemConceptMap>
<ScaleItemConceptID>30</ScaleItemConceptID>
<ScaleID>5</ScaleID>
<ItemConceptID>8</ItemConceptID>
</_x0034_1_ScaleItemConceptMap>
<_x0034_1_ScaleItemConceptMap>
<ScaleItemConceptID>31</ScaleItemConceptID>
<ScaleID>5</ScaleID>
<ItemConceptID>24</ItemConceptID>
</_x0034_1_ScaleItemConceptMap>
<_x0034_1_ScaleItemConceptMap>
<ScaleItemConceptID>32</ScaleItemConceptID>
<ScaleID>5</ScaleID>
<ItemConceptID>32</ItemConceptID>
</_x0034_1_ScaleItemConceptMap>
<_x0034_1_ScaleItemConceptMap>
<ScaleItemConceptID>33</ScaleItemConceptID>
<ScaleID>5</ScaleID>
<ItemConceptID>1</ItemConceptID>
</_x0034_1_ScaleItemConceptMap>
<_x0034_1_ScaleItemConceptMap>
<ScaleItemConceptID>34</ScaleItemConceptID>
<ScaleID>5</ScaleID>
<ItemConceptID>40</ItemConceptID>
</_x0034_1_ScaleItemConceptMap>
<_x0034_1_ScaleItemConceptMap>
<ScaleItemConceptID>35</ScaleItemConceptID>
<ScaleID>5</ScaleID>
<ItemConceptID>25</ItemConceptID>
</_x0034_1_ScaleItemConceptMap>
<_x0034_1_ScaleItemConceptMap>
<ScaleItemConceptID>36</ScaleItemConceptID>
<ScaleID>3</ScaleID>
<ItemConceptID>37</ItemConceptID>
</_x0034_1_ScaleItemConceptMap>
<_x0034_1_ScaleItemConceptMap>
<ScaleItemConceptID>37</ScaleItemConceptID>
<ScaleID>3</ScaleID>
<ItemConceptID>42</ItemConceptID>
</_x0034_1_ScaleItemConceptMap>
<_x0034_1_ScaleItemConceptMap>
<ScaleItemConceptID>38</ScaleItemConceptID>
<ScaleID>3</ScaleID>
<ItemConceptID>39</ItemConceptID>
</_x0034_1_ScaleItemConceptMap>
<_x0034_1_ScaleItemConceptMap>
<ScaleItemConceptID>39</ScaleItemConceptID>
<ScaleID>3</ScaleID>
<ItemConceptID>43</ItemConceptID>
</_x0034_1_ScaleItemConceptMap>
<_x0034_1_ScaleItemConceptMap>
<ScaleItemConceptID>40</ScaleItemConceptID>
<ScaleID>3</ScaleID>
<ItemConceptID>38</ItemConceptID>
</_x0034_1_ScaleItemConceptMap>
<_x0034_1_ScaleItemConceptMap>
<ScaleItemConceptID>41</ScaleItemConceptID>
<ScaleID>3</ScaleID>
<ItemConceptID>31</ItemConceptID>
</_x0034_1_ScaleItemConceptMap>
<_x0034_1_ScaleItemConceptMap>
<ScaleItemConceptID>42</ScaleItemConceptID>
<ScaleID>6</ScaleID>
<ItemConceptID>4</ItemConceptID>
</_x0034_1_ScaleItemConceptMap>
<_x0034_1_ScaleItemConceptMap>
<ScaleItemConceptID>43</ScaleItemConceptID>
<ScaleID>6</ScaleID>
<ItemConceptID>23</ItemConceptID>
</_x0034_1_ScaleItemConceptMap>
<_x0034_1_ScaleItemConceptMap>
<ScaleItemConceptID>44</ScaleItemConceptID>
<ScaleID>6</ScaleID>
<ItemConceptID>6</ItemConceptID>
</_x0034_1_ScaleItemConceptMap>
<_x0034_1_ScaleItemConceptMap>
<ScaleItemConceptID>45</ScaleItemConceptID>
<ScaleID>6</ScaleID>
<ItemConceptID>20</ItemConceptID>
</_x0034_1_ScaleItemConceptMap>
<_x0034_1_ScaleItemConceptMap>
<ScaleItemConceptID>46</ScaleItemConceptID>
<ScaleID>6</ScaleID>
<ItemConceptID>19</ItemConceptID>
</_x0034_1_ScaleItemConceptMap>
<_x0034_1_ScaleItemConceptMap>
<ScaleItemConceptID>47</ScaleItemConceptID>
<ScaleID>6</ScaleID>
<ItemConceptID>18</ItemConceptID>
</_x0034_1_ScaleItemConceptMap>
<_x0034_1_ScaleItemConceptMap>
<ScaleItemConceptID>48</ScaleItemConceptID>
<ScaleID>7</ScaleID>
<ItemConceptID>45</ItemConceptID>
</_x0034_1_ScaleItemConceptMap>
<_x0034_1_ScaleItemConceptMap>
<ScaleItemConceptID>49</ScaleItemConceptID>
<ScaleID>7</ScaleID>
<ItemConceptID>26</ItemConceptID>
</_x0034_1_ScaleItemConceptMap>
<_x0034_1_ScaleItemConceptMap>
<ScaleItemConceptID>50</ScaleItemConceptID>
<ScaleID>7</ScaleID>
<ItemConceptID>14</ItemConceptID>
</_x0034_1_ScaleItemConceptMap>
<_x0034_1_ScaleItemConceptMap>
<ScaleItemConceptID>51</ScaleItemConceptID>
<ScaleID>7</ScaleID>
<ItemConceptID>46</ItemConceptID>
</_x0034_1_ScaleItemConceptMap>
<_x0034_1_ScaleItemConceptMap>
<ScaleItemConceptID>52</ScaleItemConceptID>
<ScaleID>7</ScaleID>
<ItemConceptID>41</ItemConceptID>
</_x0034_1_ScaleItemConceptMap>
<_x0034_1_ScaleItemConceptMap>
<ScaleItemConceptID>53</ScaleItemConceptID>
<ScaleID>7</ScaleID>
<ItemConceptID>36</ItemConceptID>
</_x0034_1_ScaleItemConceptMap>
<_x0034_1_ScaleItemConceptMap>
<ScaleItemConceptID>54</ScaleItemConceptID>
<ScaleID>7</ScaleID>
<ItemConceptID>44</ItemConceptID>
</_x0034_1_ScaleItemConceptMap>
<_x0034_1_ScaleItemConceptMap>
<ScaleItemConceptID>55</ScaleItemConceptID>
<ScaleID>7</ScaleID>
<ItemConceptID>3</ItemConceptID>
</_x0034_1_ScaleItemConceptMap>
<_x0034_1_ScaleItemConceptMap>
<ScaleItemConceptID>56</ScaleItemConceptID>
<ScaleID>7</ScaleID>
<ItemConceptID>2</ItemConceptID>
</_x0034_1_ScaleItemConceptMap>
<_x0034_1_ScaleItemConceptMap>
<ScaleItemConceptID>57</ScaleItemConceptID>
<ScaleID>7</ScaleID>
<ItemConceptID>35</ItemConceptID>
</_x0034_1_ScaleItemConceptMap>
<_x0034_1_ScaleItemConceptMap>
<ScaleItemConceptID>58</ScaleItemConceptID>
<ScaleID>7</ScaleID>
<ItemConceptID>29</ItemConceptID>
</_x0034_1_ScaleItemConceptMap>
<_x0034_1_ScaleItemConceptMap>
<ScaleItemConceptID>59</ScaleItemConceptID>